{
  "id": "change-2026-04-22-extended-targeted-lookup-refresh-to-detail-file-link-and-series-saves",
  "date": "2026-04-22",
  "title": "Extended targeted lookup refresh to detail, file, link, and series saves",
  "status": "implemented",
  "type": "implementation",
  "domains": [
    "docs-viewer",
    "catalogue",
    "scripts",
    "runtime"
  ],
  "summary": "Extended the incremental lookup-refresh rollout beyond work saves so detail, file, link, and series save handlers now use focused targeted refresh paths where their dependency sets are explicit.",
  "source": {
    "file": "_docs/site-change-log-2026-04.md",
    "line": 2239,
    "archive": "2026-04"
  },
  "body": "**Status:** implemented\n\n**Area:** catalogue write server / catalogue lookup\n\n**Summary:**\nExtended the incremental lookup-refresh rollout beyond work saves so detail, file, link, and series save handlers now use focused targeted refresh paths where their dependency sets are explicit.\n\n**Reason:**\nThese record families turned out to be simpler than the initial work dependency graph. Detail, file, and link saves only affect their own lookup payload plus a small parent-work surface, and series saves have no parent chain, so the next extension pass was low-risk and high-yield.\n\n**Effect:**\n`POST /catalogue/work-detail/save`, `POST /catalogue/work-file/save`, `POST /catalogue/work-link/save`, and `POST /catalogue/series/save` now return `lookup_refresh` metadata and avoid full lookup refresh for the straightforward targeted cases. Parent/id move-style cases such as `work_file.work_id` changes still fall back to `full`.\n\n**Affected files/docs:**\n- `scripts/catalogue_lookup.py`\n- `scripts/studio/catalogue_write_server.py`\n- [Catalogue Write Server](/docs/?scope=studio&doc=scripts-catalogue-write-server)\n- [Catalogue Lookup Invalidation Request](/docs/?scope=studio&doc=site-request-catalogue-lookup-invalidation)",
  "migration": {
    "confidence": "high",
    "warnings": []
  },
  "area": "catalogue write server / catalogue lookup",
  "effect": "`POST /catalogue/work-detail/save`, `POST /catalogue/work-file/save`, `POST /catalogue/work-link/save`, and `POST /catalogue/series/save` now return `lookup_refresh` metadata and avoid full lookup refresh for the straightforward targeted cases. Parent/id move-style cases such as `work_file.work_id` changes still fall back to `full`.",
  "related_docs": [
    "scripts-catalogue-write-server",
    "site-request-catalogue-lookup-invalidation"
  ],
  "related_files": [
    "scripts/catalogue_lookup.py",
    "scripts/studio/catalogue_write_server.py"
  ],
  "change_request_doc_id": "site-request-catalogue-lookup-invalidation",
  "affected": {
    "files": [
      "scripts/catalogue_lookup.py",
      "scripts/studio/catalogue_write_server.py"
    ],
    "docs": [
      "scripts-catalogue-write-server",
      "site-request-catalogue-lookup-invalidation"
    ]
  }
}
