{
  "id": "change-2026-05-15-studio-ui-rule-ui-102-the-import-body-moved-into-includes-docs-viewer-shell",
  "date": "2026-05-15",
  "title": "UI-102: the import body moved into _includes/docs_viewer_shell.html, _includes/docs_import_shell.html was retired, and the filename-conflict...",
  "status": "implemented",
  "type": "decision",
  "domains": [
    "studio-ui",
    "docs-viewer",
    "library",
    "config"
  ],
  "subjects": [
    "studio-ui-rule",
    "UI-102",
    "/docs/?scope=<scope>&mode=manage",
    "modal composition migration"
  ],
  "summary": "the Docs Import modal still carried the old standalone-page migration shape through _includes/docs_import_shell.html and the filename-conflict dialog used a separate import-specific modal shell. Outcome: the import body moved into _includes/docs_viewer_shell.html, _includes/docs_import_shell.html was retired, and the filename-conflict dialog now uses the docsViewer__modal* shell, status slot, default-width action row, focus return, and focus containment.",
  "source": {
    "file": "_docs/studio-ui-rules.md",
    "line": 67,
    "archive": "studio-ui-rules"
  },
  "body": "## UI Rule Log 2026-05-15 / UI-102\n\n- status: adopted\n- route: `/docs/?scope=<scope>&mode=manage`\n- issue: the Docs Import modal still carried the old standalone-page migration shape through `_includes/docs_import_shell.html` and the filename-conflict dialog used a separate import-specific modal shell.\n- triage: modal composition migration\n- reasoning: Docs Import is now a Docs Viewer management workflow, so its modal markup should be part of the Docs Viewer management shell and any nested conflict dialog should use the same portable modal anatomy as metadata, settings, and transient Docs Viewer management modals.\n- outcome: the import body moved into `_includes/docs_viewer_shell.html`, `_includes/docs_import_shell.html` was retired, and the filename-conflict dialog now uses the `docsViewer__modal*` shell, status slot, default-width action row, focus return, and focus containment.\n- files changed:\n  - `_includes/docs_viewer_shell.html`\n  - `assets/docs-viewer/js/docs-html-import.js`\n  - `assets/docs-viewer/js/docs-html-import-modals.js`\n  - `assets/docs-viewer/js/docs-viewer-management-modals.js`\n  - `assets/docs-viewer/css/docs-viewer-management.css`\n- local verification:\n  - open `/docs/?scope=library&mode=manage&doc=library&import=1` and confirm the import modal initializes, action focus remains inside the modal, and the filename-conflict dialog follows the Docs Viewer modal shell\n  - confirm no `/studio/docs-import/` route is needed for the importer\n",
  "migration": {
    "confidence": "high",
    "warnings": []
  },
  "effect": "Docs Import is now a Docs Viewer management workflow, so its modal markup should be part of the Docs Viewer management shell and any nested conflict dialog should use the same portable modal anatomy as metadata, settings, and transient Docs Viewer management modals.",
  "area": "/docs/?scope=<scope>&mode=manage / modal composition migration",
  "related_files": [
    "`_includes/docs_viewer_shell.html`",
    "`assets/docs-viewer/js/docs-html-import.js`",
    "`assets/docs-viewer/js/docs-html-import-modals.js`",
    "`assets/docs-viewer/js/docs-viewer-management-modals.js`",
    "`assets/docs-viewer/css/docs-viewer-management.css`"
  ],
  "affected": {
    "files": [
      "`_includes/docs_viewer_shell.html`",
      "`assets/docs-viewer/js/docs-html-import.js`",
      "`assets/docs-viewer/js/docs-html-import-modals.js`",
      "`assets/docs-viewer/js/docs-viewer-management-modals.js`",
      "`assets/docs-viewer/css/docs-viewer-management.css`"
    ]
  },
  "verification": [
    "open `/docs/?scope=library&mode=manage&doc=library&import=1` and confirm the import modal initializes, action focus remains inside the modal, and the filename-conflict dialog follows the Docs Viewer modal shell",
    "confirm no `/studio/docs-import/` route is needed for the importer"
  ]
}
