{
  "id": "change-2026-04-18-added-the-studio-moment-import-flow",
  "date": "2026-04-18",
  "title": "Added the Studio moment import flow",
  "status": "implemented",
  "type": "implementation",
  "domains": [
    "docs-viewer",
    "catalogue",
    "workflow"
  ],
  "summary": "Added the dedicated moment import workflow at `/studio/catalogue-moment-import/`.",
  "source": {
    "file": "_docs/site-change-log-2026-04.md",
    "line": 3456,
    "archive": "2026-04"
  },
  "body": "**Status:** implemented\n\n**Area:** Studio catalogue pipeline\n\n**Summary:**\nAdded the dedicated moment import workflow at `/studio/catalogue-moment-import/`.\n\n**Reason:**\nMoments needed a scoped import path that could preview and apply source-file changes without running a broader catalogue maintenance flow.\n\n**Effect:**\nThe moment import UI now supports explicit source-file preview/apply, targeted moment rebuilds, catalogue-search rebuild, and first-pass activity/build reporting without folder scanning or srcset generation.\n\n**Affected files/docs:**\n- `/studio/catalogue-moment-import/`\n- [Catalogue Moment Editor](/docs/?scope=studio&doc=catalogue-moment-editor)\n\n**Notes:**\nThis was Phase 2 of the Studio implementation sequence.",
  "migration": {
    "confidence": "high",
    "warnings": []
  },
  "area": "Studio catalogue pipeline",
  "effect": "The moment import UI now supports explicit source-file preview/apply, targeted moment rebuilds, catalogue-search rebuild, and first-pass activity/build reporting without folder scanning or srcset generation.",
  "related_docs": [
    "catalogue-moment-editor"
  ],
  "affected": {
    "docs": [
      "catalogue-moment-editor"
    ]
  }
}
