{
  "id": "change-2026-05-03-added-json-schema-adoption-change-request",
  "date": "2026-05-03",
  "title": "Added JSON Schema adoption change request",
  "status": "unknown",
  "type": "implementation",
  "domains": [
    "docs-viewer",
    "search",
    "catalogue",
    "data-models",
    "config",
    "workflow"
  ],
  "summary": "Added a change request for selective JSON Schema adoption.",
  "source": {
    "file": "_docs/site-change-log-2026-05.md",
    "line": 641,
    "archive": "2026-05"
  },
  "body": "**Status:** documented\n\n**Area:** config / validation\n\n**Summary:**\nAdded a change request for selective JSON Schema adoption.\n\n**Reason:**\nThe Library export config schema raised the question of whether similar schema contracts would help elsewhere in the repo.\n\n**Effect:**\nThe new request recommends using schemas selectively for compact hand-edited config contracts, with search policy and the catalogue field registry as the first likely candidates. It explicitly avoids broad schema adoption for generated payloads or unstable canonical records.\n\n**Affected files/docs:**\n\n- [JSON Schema Adoption Request](/docs/?scope=studio&doc=site-request-json-schema-adoption)\n- [Change Requests](/docs/?scope=studio&doc=change-requests)\n- [Config](/docs/?scope=studio&doc=config)\n- [Search Policy JSON](/docs/?scope=studio&doc=config-search-policy-json)\n- [Catalogue Field Registry Review](/docs/?scope=studio&doc=catalogue-field-registry-review)\n- [Site Change Log](/docs/?scope=studio&doc=site-change-log)\n\n**Benefits:**\nThe repo now has a clear backlog item for where schemas are likely to add value, without committing to schema everything.\n\n**Risks:**\nSchema adoption still needs to stay disciplined so it does not duplicate unstable implementation details or replace semantic validation scripts.",
  "migration": {
    "confidence": "low",
    "warnings": []
  },
  "area": "config / validation",
  "effect": "The new request recommends using schemas selectively for compact hand-edited config contracts, with search policy and the catalogue field registry as the first likely candidates. It explicitly avoids broad schema adoption for generated payloads or unstable canonical records.",
  "related_docs": [
    "site-request-json-schema-adoption",
    "change-requests",
    "config",
    "config-search-policy-json",
    "catalogue-field-registry-review",
    "site-change-log"
  ],
  "change_request_doc_id": "site-request-json-schema-adoption",
  "affected": {
    "docs": [
      "site-request-json-schema-adoption",
      "change-requests",
      "config",
      "config-search-policy-json",
      "catalogue-field-registry-review",
      "site-change-log"
    ]
  }
}
