{
  "id": "change-2026-05-03-defined-library-export-config-schema",
  "date": "2026-05-03",
  "title": "Defined Library export config schema",
  "status": "implemented",
  "type": "documentation",
  "domains": [
    "docs-viewer",
    "library",
    "data-models",
    "config",
    "workflow"
  ],
  "summary": "Added the first formal JSON Schema for Library export config files and documented the config contract.",
  "source": {
    "file": "_docs/site-change-log-2026-05.md",
    "line": 701,
    "archive": "2026-05"
  },
  "body": "**Status:** implemented\n\n**Area:** Library / Studio docs export\n\n**Summary:**\nAdded the first formal JSON Schema for Library export config files and documented the config contract.\n\n**Reason:**\nLibrary export needs a stable config-driven boundary before adding initial export configs, exporter code, or Studio UI.\n\n**Effect:**\nExport patterns now have a defined shape for scope support, target format, output path pattern, selection rules, limits, run metadata, document field mappings, and transform names. The schema is Library-first but keeps scope support extensible for future Docs Viewer scopes.\n\n**Affected files/docs:**\n\n- `assets/studio/data/library_export_configs.schema.json`\n- [Library Export Configs](/docs/?scope=studio&doc=config-library-export-configs)\n- [Library Export v1](/docs/?scope=studio&doc=library-export)\n- [Library Scope](/docs/?scope=studio&doc=data-models-library)\n- [Config](/docs/?scope=studio&doc=config)\n- [Site Change Log](/docs/?scope=studio&doc=site-change-log)\n\n**Benefits:**\nThe next task can add concrete export configs against a reviewed shape, and the later Studio UI/export engine can avoid hardcoded field sets.\n\n**Risks:**\nThe schema validates static config shape only; runtime validation still has to check selected docs, source-derived required fields, and resolved output paths.",
  "migration": {
    "confidence": "high",
    "warnings": []
  },
  "area": "Library / Studio docs export",
  "effect": "Export patterns now have a defined shape for scope support, target format, output path pattern, selection rules, limits, run metadata, document field mappings, and transform names. The schema is Library-first but keeps scope support extensible for future Docs Viewer scopes.",
  "related_docs": [
    "config-library-export-configs",
    "library-export",
    "data-models-library",
    "config",
    "site-change-log"
  ],
  "related_files": [
    "assets/studio/data/library_export_configs.schema.json"
  ],
  "affected": {
    "files": [
      "assets/studio/data/library_export_configs.schema.json"
    ],
    "docs": [
      "config-library-export-configs",
      "library-export",
      "data-models-library",
      "config",
      "site-change-log"
    ]
  }
}
